User Input,Chatbot Response,Timestamp
hii,Growing a vegetable garden allows you to enjoy fresh produce and connect with nature.,2025-03-12 12:07:33
what is your name,My name is Chatbot.,2025-03-12 12:07:47
hii,"Gardening tips include choosing the right plants for your climate, watering properly, and using organic fertilizers.",2025-03-14 11:17:44
Hello,Hi there,2025-03-14 11:17:52
Who are you,I am a chatbot,2025-03-14 11:19:30
What is todays weather,I can answer questions and provide assistance,2025-03-14 11:19:45
Weather,You can check the weather on a weather app or website.,2025-03-14 11:19:53
weather,You can check the weather on a weather app or website.,2025-03-14 11:20:17
weathe,Growing a vegetable garden allows you to enjoy fresh produce and connect with nature.,2025-03-14 11:20:20
weather,"I'm sorry, I cannot provide real-time weather information.",2025-03-14 11:20:23
credit score,You can check your credit score for free on several websites such as Credit Karma and Credit Sesame.,2025-03-14 11:20:38
credit score,You can check your credit score for free on several websites such as Credit Karma and Credit Sesame.,2025-03-14 11:20:48
